{
  "schema_version": "0.1.0",
  "status": "pass_1_complete",
  "generated_at": "2026-07-14",
  "attributes": [
    {"attribute_id":"visual.bbox.coordinates","subject_type":"bbox_observation","value_type":"normalized_box","family":"evidence_observation","scope":{"temporal":true,"spatial":true},"provenance_class":"detector_or_manual","architectural_layer":"evidence_substrate","iteration_model":"append_or_supersede","maturity_behavior":"observation_not_semantic_truth","authority_behavior":"manual_geometry_over_detector_geometry_in_scope","dependencies":[],"invalidation_behavior":"source_or_geometry_change_marks_downstream_projection_stale","projection_eligible":true,"implementation_status":"operational"},
    {"attribute_id":"visual.bbox.time_interval","subject_type":"bbox_observation","value_type":"time_interval_seconds","family":"evidence_observation","scope":{"temporal":true,"spatial":false},"provenance_class":"detector_or_manual","architectural_layer":"evidence_substrate","iteration_model":"append_or_supersede","maturity_behavior":"independent_from_validity","authority_behavior":"manual_interval_wins_in_scope","dependencies":["source_media.clock"],"invalidation_behavior":"clock_change_invalidates_projection_and_dependents","projection_eligible":true,"implementation_status":"operational"},
    {"attribute_id":"visual.detector_class","subject_type":"visual_observation","value_type":"controlled_term","family":"raw_classification","scope":{"temporal":true,"spatial":true},"provenance_class":"model_output","architectural_layer":"evidence_substrate","iteration_model":"immutable_versioned_observation","maturity_behavior":"raw","authority_behavior":"never_overrides_manual_assignment","dependencies":["visual.bbox.coordinates"],"invalidation_behavior":"preserve_in_traceback","projection_eligible":true,"implementation_status":"operational"},
    {"attribute_id":"visual.track.reference","subject_type":"visual_track","value_type":"namespaced_identifier","family":"evidence_aggregation","scope":{"temporal":true,"spatial":true},"provenance_class":"tracker_or_fallback_generator","architectural_layer":"evidence_substrate","iteration_model":"versioned_aggregate","maturity_behavior":"not_a_semantic_entity","authority_behavior":"target_reference_only","dependencies":["visual.bbox.coordinates","visual.bbox.time_interval"],"invalidation_behavior":"split_or_merge_requires_assignment_review","projection_eligible":false,"implementation_status":"partial"},
    {"attribute_id":"semantic.assignment.label","subject_type":"semantic_entity_assignment","value_type":"string_or_vocabulary_term","family":"assignment","scope":{"temporal":true,"spatial":true},"provenance_class":"analyst_or_candidate","architectural_layer":"decision_ledger_target","iteration_model":"superseding_decisions","maturity_behavior":"candidate_or_manual_correction","authority_behavior":"explicit_user_correction_highest","dependencies":["visual.track.reference"],"invalidation_behavior":"preserve_authority_mark_validity_stale_require_review","projection_eligible":true,"implementation_status":"operational"},
    {"attribute_id":"narrative_agent.assignment","subject_type":"narrative_agent_assignment","value_type":"narrative_agent_reference","family":"assignment","scope":{"temporal":true,"spatial":true},"provenance_class":"analyst_or_triangulated_candidate","architectural_layer":"decision_ledger_target","iteration_model":"superseding_decisions","maturity_behavior":"requires_governed_confirmation","authority_behavior":"detector_cannot_declare_agent_truth","dependencies":["semantic.assignment.label"],"invalidation_behavior":"mark_stale_and_review_on_subject_or_time_change","projection_eligible":true,"implementation_status":"operational"},
    {"attribute_id":"governance.decision.action","subject_type":"decision_event","value_type":"typed_action","family":"governance","scope":{"temporal":true,"spatial":true},"provenance_class":"analyst_or_governed_process","architectural_layer":"canonical_decision_ledger","iteration_model":"append_only","maturity_behavior":"action_specific","authority_behavior":"explicit_user_correction_final","dependencies":[],"invalidation_behavior":"never_delete_supersede_or_change_validity","projection_eligible":false,"implementation_status":"operational"},
    {"attribute_id":"governance.authority","subject_type":"governed_claim","value_type":"authority_state","family":"governance","scope":{"temporal":false,"spatial":false},"provenance_class":"governance_metadata","architectural_layer":"decision_and_projection","iteration_model":"event_derived","maturity_behavior":"independent_dimension","authority_behavior":"manual_correction_above_all_automatic_sources","dependencies":[],"invalidation_behavior":"authority_history_preserved","projection_eligible":true,"implementation_status":"partial"},
    {"attribute_id":"governance.maturity","subject_type":"governed_claim","value_type":"maturity_state","family":"governance","scope":{"temporal":false,"spatial":false},"provenance_class":"governance_metadata","architectural_layer":"decision_and_projection","iteration_model":"event_derived","maturity_behavior":"independent_dimension","authority_behavior":"does_not_replace_authority","dependencies":[],"invalidation_behavior":"may_remain_confirmed_while_validity_stale","projection_eligible":true,"implementation_status":"partial"},
    {"attribute_id":"governance.validity","subject_type":"governed_claim","value_type":"validity_state","family":"governance","scope":{"temporal":false,"spatial":false},"provenance_class":"dependency_evaluation","architectural_layer":"projection_engine","iteration_model":"recomputed","maturity_behavior":"independent_dimension","authority_behavior":"does_not_erase_authority","dependencies":["visual.bbox.time_interval","visual.track.reference"],"invalidation_behavior":"stale_invalid_or_current","projection_eligible":true,"implementation_status":"operational"},
    {"attribute_id":"projection.display_label","subject_type":"projected_subject_state","value_type":"string","family":"presentation_projection","scope":{"temporal":true,"spatial":true},"provenance_class":"deterministic_projection","architectural_layer":"projection_engine","iteration_model":"recomputed","maturity_behavior":"reports_source_maturity","authority_behavior":"highest_valid_in_scope","dependencies":["visual.detector_class","semantic.assignment.label","governance.authority","governance.validity"],"invalidation_behavior":"refresh_projection","projection_eligible":true,"implementation_status":"operational"},
    {"attribute_id":"traceback.evidence_refs","subject_type":"governed_claim","value_type":"reference_array","family":"traceback","scope":{"temporal":false,"spatial":false},"provenance_class":"system_and_analyst","architectural_layer":"all_layers","iteration_model":"append_only","maturity_behavior":"required_for_mature_claim","authority_behavior":"evidences_not_decides","dependencies":[],"invalidation_behavior":"preserve","projection_eligible":true,"implementation_status":"partial"}
  ]
}
